{
  "$schema": "https://json-schema.org/draft/2020-12/schema",
  "$id": "https://github.com/seorilabs/.github/contracts/release-exception.schema.json",
  "title": "Reviewed human release exception; does not assert product E2E passed",
  "type": "object",
  "additionalProperties": false,
  "properties": {
    "schemaVersion": {
      "const": 1
    },
    "kind": {
      "const": "human_release_exception"
    },
    "state": {
      "const": "active"
    },
    "decisionStatus": {
      "const": "human_exception"
    },
    "productE2eStatus": {
      "const": "blocked"
    },
    "id": {
      "type": "string",
      "minLength": 1,
      "pattern": "^[a-z0-9][a-z0-9.-]+$"
    },
    "repository": {
      "type": "string",
      "minLength": 1,
      "pattern": "^seorilabs/[A-Za-z0-9._-]+$"
    },
    "releaseTag": {
      "type": "string",
      "minLength": 1,
      "pattern": "^v[0-9]+\\.[0-9]+\\.[0-9]+$"
    },
    "sourceSha": {
      "type": "string",
      "pattern": "^[a-f0-9]{40}$"
    },
    "baselineSourceSha": {
      "type": "string",
      "pattern": "^[a-f0-9]{40}$"
    },
    "verifierSha": {
      "type": "string",
      "pattern": "^[a-f0-9]{40}$"
    },
    "configurationFingerprint": {
      "type": "string",
      "pattern": "^[a-f0-9]{64}$"
    },
    "inventorySha256": {
      "type": "string",
      "pattern": "^[a-f0-9]{64}$"
    },
    "productTreeSha256": {
      "type": "string",
      "pattern": "^[a-f0-9]{64}$"
    },
    "approvalSha256": {
      "type": "string",
      "pattern": "^[a-f0-9]{64}$"
    },
    "proposalSha256": {
      "type": "string",
      "pattern": "^[a-f0-9]{64}$"
    },
    "observationsSha256": {
      "type": "string",
      "pattern": "^[a-f0-9]{64}$"
    },
    "riskNotesSha256": {
      "type": "string",
      "pattern": "^[a-f0-9]{64}$"
    },
    "approvedAt": {
      "type": "string",
      "pattern": "^\\d{4}-\\d{2}-\\d{2}T\\d{2}:\\d{2}:\\d{2}(?:\\.\\d+)?(?:Z|\\+00:00)$"
    },
    "expiresAt": {
      "type": "string",
      "pattern": "^\\d{4}-\\d{2}-\\d{2}T\\d{2}:\\d{2}:\\d{2}(?:\\.\\d+)?(?:Z|\\+00:00)$"
    },
    "target": {
      "enum": [
        "google-play",
        "app-store"
      ]
    },
    "approvedRisks": {
      "type": "array",
      "minItems": 1,
      "uniqueItems": true,
      "items": {
        "type": "string",
        "minLength": 1
      }
    },
    "features": {
      "type": "array",
      "minItems": 1,
      "items": {
        "type": "object",
        "additionalProperties": false,
        "required": [
          "id",
          "core",
          "originalVerdict",
          "wholeFeatureStatus"
        ],
        "properties": {
          "id": {
            "type": "string",
            "minLength": 1
          },
          "core": {
            "type": "boolean"
          },
          "originalVerdict": {
            "type": "string",
            "minLength": 1
          },
          "wholeFeatureStatus": {
            "enum": [
              "partial",
              "unknown",
              "blocked",
              "not_run",
              "failed"
            ]
          }
        }
      }
    },
    "releaseBinding": {
      "oneOf": [
        {
          "type": "null"
        },
        {
          "type": "object",
          "additionalProperties": false,
          "required": [
            "tagObjectSha",
            "tagReceiptSha256"
          ],
          "properties": {
            "tagObjectSha": {
              "type": "string",
              "pattern": "^[a-f0-9]{40}$"
            },
            "tagReceiptSha256": {
              "type": "string",
              "pattern": "^[a-f0-9]{64}$"
            }
          }
        }
      ]
    }
  },
  "required": [
    "schemaVersion",
    "kind",
    "state",
    "decisionStatus",
    "productE2eStatus",
    "id",
    "repository",
    "releaseTag",
    "sourceSha",
    "baselineSourceSha",
    "verifierSha",
    "configurationFingerprint",
    "inventorySha256",
    "productTreeSha256",
    "approvalSha256",
    "proposalSha256",
    "observationsSha256",
    "riskNotesSha256",
    "approvedAt",
    "expiresAt",
    "target",
    "approvedRisks",
    "features",
    "releaseBinding"
  ]
}
